{
  "step": 3,
  "source": "c99.y",
  "summary": {
    "source": "c99.y",
    "symbols": "158",
    "terminals": "87",
    "nonterminals": "68",
    "productions_with_augmented": "238",
    "start_symbol": "translation_unit"
  },
  "analysis": {
    "productions_with_actions": "0",
    "unused_terminals_count": "0",
    "unreachable_nonterminals_count": "0"
  },
  "symbols": [
    {
      "id": 0,
      "name": "RETURN",
      "kind": "Terminal",
      "is_literal_char": false
    },
    {
      "id": 1,
      "name": "BREAK",
      "kind": "Terminal",
      "is_literal_char": false
    },
    {
      "id": 2,
      "name": "CONTINUE",
      "kind": "Terminal",
      "is_literal_char": false
    },
    {
      "id": 3,
      "name": "GOTO",
      "kind": "Terminal",
      "is_literal_char": false
    },
    {
      "id": 4,
      "name": "EXTERN",
      "kind": "Terminal",
      "is_literal_char": false
    },
    {
      "id": 5,
      "name": "ADD_ASSIGN",
      "kind": "Terminal",
      "is_literal_char": false
    },
    {
      "id": 6,
      "name": "AND_ASSIGN",
      "kind": "Terminal",
      "is_literal_char": false
    },
    {
      "id": 7,
      "name": "CHAR",
      "kind": "Terminal",
      "is_literal_char": false
    },
    {
      "id": 8,
      "name": "BOOL",
      "kind": "Terminal",
      "is_literal_char": false
    },
    {
      "id": 9,
      "name": "XOR_ASSIGN",
      "kind": "Terminal",
      "is_literal_char": false
    },
    {
      "id": 10,
      "name": "IMAGINARY",
      "kind": "Terminal",
      "is_literal_char": false
    },
    {
      "id": 11,
      "name": "STATIC",
      "kind": "Terminal",
      "is_literal_char": false
    },
    {
      "id": 12,
      "name": "MOD_ASSIGN",
      "kind": "Terminal",
      "is_literal_char": false
    },
    {
      "id": 13,
      "name": "LEFT_ASSIGN",
      "kind": "Terminal",
      "is_literal_char": false
    },
    {
      "id": 14,
      "name": "LEFT_OP",
      "kind": "Terminal",
      "is_literal_char": false
    },
    {
      "id": 15,
      "name": "OR_ASSIGN",
      "kind": "Terminal",
      "is_literal_char": false
    },
    {
      "id": 16,
      "name": "FLOAT",
      "kind": "Terminal",
      "is_literal_char": false
    },
    {
      "id": 17,
      "name": "DIV_ASSIGN",
      "kind": "Terminal",
      "is_literal_char": false
    },
    {
      "id": 18,
      "name": "OR_OP",
      "kind": "Terminal",
      "is_literal_char": false
    },
    {
      "id": 19,
      "name": "SIGNED",
      "kind": "Terminal",
      "is_literal_char": false
    },
    {
      "id": 20,
      "name": "CONSTANT",
      "kind": "Terminal",
      "is_literal_char": false
    },
    {
      "id": 21,
      "name": "RIGHT_OP",
      "kind": "Terminal",
      "is_literal_char": false
    },
    {
      "id": 22,
      "name": "STRING_LITERAL",
      "kind": "Terminal",
      "is_literal_char": false
    },
    {
      "id": 23,
      "name": "MUL_ASSIGN",
      "kind": "Terminal",
      "is_literal_char": false
    },
    {
      "id": 24,
      "name": "AND_OP",
      "kind": "Terminal",
      "is_literal_char": false
    },
    {
      "id": 25,
      "name": "NE_OP",
      "kind": "Terminal",
      "is_literal_char": false
    },
    {
      "id": 26,
      "name": "LE_OP",
      "kind": "Terminal",
      "is_literal_char": false
    },
    {
      "id": 27,
      "name": "SIZEOF",
      "kind": "Terminal",
      "is_literal_char": false
    },
    {
      "id": 28,
      "name": "TYPE_NAME",
      "kind": "Terminal",
      "is_literal_char": false
    },
    {
      "id": 29,
      "name": "DEC_OP",
      "kind": "Terminal",
      "is_literal_char": false
    },
    {
      "id": 30,
      "name": "ELLIPSIS",
      "kind": "Terminal",
      "is_literal_char": false
    },
    {
      "id": 31,
      "name": "CONST",
      "kind": "Terminal",
      "is_literal_char": false
    },
    {
      "id": 32,
      "name": "RIGHT_ASSIGN",
      "kind": "Terminal",
      "is_literal_char": false
    },
    {
      "id": 33,
      "name": "SUB_ASSIGN",
      "kind": "Terminal",
      "is_literal_char": false
    },
    {
      "id": 34,
      "name": "PTR_OP",
      "kind": "Terminal",
      "is_literal_char": false
    },
    {
      "id": 35,
      "name": "GE_OP",
      "kind": "Terminal",
      "is_literal_char": false
    },
    {
      "id": 36,
      "name": "IDENTIFIER",
      "kind": "Terminal",
      "is_literal_char": false
    },
    {
      "id": 37,
      "name": "AUTO",
      "kind": "Terminal",
      "is_literal_char": false
    },
    {
      "id": 38,
      "name": "REGISTER",
      "kind": "Terminal",
      "is_literal_char": false
    },
    {
      "id": 39,
      "name": "INLINE",
      "kind": "Terminal",
      "is_literal_char": false
    },
    {
      "id": 40,
      "name": "IF",
      "kind": "Terminal",
      "is_literal_char": false
    },
    {
      "id": 41,
      "name": "VOID",
      "kind": "Terminal",
      "is_literal_char": false
    },
    {
      "id": 42,
      "name": "RESTRICT",
      "kind": "Terminal",
      "is_literal_char": false
    },
    {
      "id": 43,
      "name": "FOR",
      "kind": "Terminal",
      "is_literal_char": false
    },
    {
      "id": 44,
      "name": "INT",
      "kind": "Terminal",
      "is_literal_char": false
    },
    {
      "id": 45,
      "name": "LONG",
      "kind": "Terminal",
      "is_literal_char": false
    },
    {
      "id": 46,
      "name": "SHORT",
      "kind": "Terminal",
      "is_literal_char": false
    },
    {
      "id": 47,
      "name": "DOUBLE",
      "kind": "Terminal",
      "is_literal_char": false
    },
    {
      "id": 48,
      "name": "SWITCH",
      "kind": "Terminal",
      "is_literal_char": false
    },
    {
      "id": 49,
      "name": "VOLATILE",
      "kind": "Terminal",
      "is_literal_char": false
    },
    {
      "id": 50,
      "name": "INC_OP",
      "kind": "Terminal",
      "is_literal_char": false
    },
    {
      "id": 51,
      "name": "COMPLEX",
      "kind": "Terminal",
      "is_literal_char": false
    },
    {
      "id": 52,
      "name": "TYPEDEF",
      "kind": "Terminal",
      "is_literal_char": false
    },
    {
      "id": 53,
      "name": "UNSIGNED",
      "kind": "Terminal",
      "is_literal_char": false
    },
    {
      "id": 54,
      "name": "STRUCT",
      "kind": "Terminal",
      "is_literal_char": false
    },
    {
      "id": 55,
      "name": "ENUM",
      "kind": "Terminal",
      "is_literal_char": false
    },
    {
      "id": 56,
      "name": "ELSE",
      "kind": "Terminal",
      "is_literal_char": false
    },
    {
      "id": 57,
      "name": "CASE",
      "kind": "Terminal",
      "is_literal_char": false
    },
    {
      "id": 58,
      "name": "DEFAULT",
      "kind": "Terminal",
      "is_literal_char": false
    },
    {
      "id": 59,
      "name": "UNION",
      "kind": "Terminal",
      "is_literal_char": false
    },
    {
      "id": 60,
      "name": "EQ_OP",
      "kind": "Terminal",
      "is_literal_char": false
    },
    {
      "id": 61,
      "name": "WHILE",
      "kind": "Terminal",
      "is_literal_char": false
    },
    {
      "id": 62,
      "name": "DO",
      "kind": "Terminal",
      "is_literal_char": false
    },
    {
      "id": 63,
      "name": "declaration_list",
      "kind": "Nonterminal",
      "is_literal_char": false
    },
    {
      "id": 64,
      "name": "external_declaration",
      "kind": "Nonterminal",
      "is_literal_char": false
    },
    {
      "id": 65,
      "name": "translation_unit",
      "kind": "Nonterminal",
      "is_literal_char": false
    },
    {
      "id": 66,
      "name": "iteration_statement",
      "kind": "Nonterminal",
      "is_literal_char": false
    },
    {
      "id": 67,
      "name": "selection_statement",
      "kind": "Nonterminal",
      "is_literal_char": false
    },
    {
      "id": 68,
      "name": "expression_statement",
      "kind": "Nonterminal",
      "is_literal_char": false
    },
    {
      "id": 69,
      "name": "block_item",
      "kind": "Nonterminal",
      "is_literal_char": false
    },
    {
      "id": 70,
      "name": "struct_or_union_specifier",
      "kind": "Nonterminal",
      "is_literal_char": false
    },
    {
      "id": 71,
      "name": "declaration_specifiers",
      "kind": "Nonterminal",
      "is_literal_char": false
    },
    {
      "id": 72,
      "name": "type_specifier",
      "kind": "Nonterminal",
      "is_literal_char": false
    },
    {
      "id": 73,
      "name": "expression",
      "kind": "Nonterminal",
      "is_literal_char": false
    },
    {
      "id": 74,
      "name": "struct_or_union",
      "kind": "Nonterminal",
      "is_literal_char": false
    },
    {
      "id": 75,
      "name": "type_name",
      "kind": "Nonterminal",
      "is_literal_char": false
    },
    {
      "id": 76,
      "name": "statement",
      "kind": "Nonterminal",
      "is_literal_char": false
    },
    {
      "id": 77,
      "name": "assignment_operator",
      "kind": "Nonterminal",
      "is_literal_char": false
    },
    {
      "id": 78,
      "name": "and_expression",
      "kind": "Nonterminal",
      "is_literal_char": false
    },
    {
      "id": 79,
      "name": "relational_expression",
      "kind": "Nonterminal",
      "is_literal_char": false
    },
    {
      "id": 80,
      "name": "jump_statement",
      "kind": "Nonterminal",
      "is_literal_char": false
    },
    {
      "id": 81,
      "name": "init_declarator",
      "kind": "Nonterminal",
      "is_literal_char": false
    },
    {
      "id": 82,
      "name": "shift_expression",
      "kind": "Nonterminal",
      "is_literal_char": false
    },
    {
      "id": 83,
      "name": "struct_declaration",
      "kind": "Nonterminal",
      "is_literal_char": false
    },
    {
      "id": 84,
      "name": "assignment_expression",